IDEntidad,Rut,CodigoInt,nombre,domicilio,giro,representante,actividades,naturaleza,administrador,institucion,idportal,tipoEntidad,remunerado
814,657083402,,Federacion Esgrima,Tarapaca,Deportiva,David Jimenez,Deportiva,FEderacion,,SUBSECRETARIA DEL DEPORTE,BA001,Con personalidad jurídica,
1186,769818200,,Azerta Comunicaciones,Américo Vespucio 1561, piso 6,Asesorías comunicacionales y Asuntos Públicos,Felipe Edwards Marín,Minería, energía, retail, agrícola, financiera, puertos, obras públicas, mercados regulados, entre otras materias.,Sociedad Anónima Cerrada,,SUBSECRETARIA DEL DEPORTE,BA001,Con personalidad jurídica,True
1208,650903412,,Fundación Multitudes,Miraflores 113 Oficina 64,Fundación,Paulina Ibarra,Servicios de institutos de estudios, fundaciones, corporación de desarrollo,Fundación,,SUBSECRETARIA DEL DEPORTE,BA001,Con personalidad jurídica,False
1261,700026604,,Confederacion de la Produccion y del Comercio,Monseñor Sótero Sanz 182 Providencia,Gremio Empresarial,Andrés Santa Cruz López,Defender y promover el derecho de propiedad privada; Defender y promover la libertad de empresa, entendida como el conjunto de condiciones que faciliten la creación y mantención de iniciativas empresariales y un marco económico, legal, tributario y labora,Confederación de Federaciones y Asociaciones Gremiales,,SUBSECRETARIA DEL DEPORTE,BA001,Con personalidad jurídica,False
1299,767387202,,Bernstein y Woodward Comunicaciones Limitada,Augusto Leguía Norte 100, oficina 201, Las Condes, Santiago,Comunicaciones,Juan de Dios Larraín Matte,Servicios Comunicacionales, Promoción, Publicidad y Marketing,Sociedad Limitada,,SUBSECRETARIA DEL DEPORTE,BA001,Con personalidad jurídica,True
1297,767387202,,Bernstein y Woodward Comunicaciones Limitada,Augusto Leguía Norte 100, oficina 201, Las Condes, Santiago,Comunicaciones,Juan de Dios Larraín Matte,Servicios Comunicacionales, Promoción, Publicidad y Marketing,Sociedad Limitada,,CONSEJO NACIONAL DE LA CULTURA Y LAS ARTES (CNCA),AV001,Con personalidad jurídica,True
1306,733626003,,MOVIMIENTO POR LA DIVERSIDAD SEXUAL MUMS / CENTRO DE ESTUDIOS DE LA SEXUALIDAD ONG CES,SANTA MÓNICA 2317,ONG,MARCELO LEIVA GUTIERREZ,ORGANIZACIÓN NO GUBERNAMENTAL,ORGANIZACIÓN SIN FINES DE LUCRO,,CONSEJO NACIONAL DE LA CULTURA Y LAS ARTES (CNCA),AV001,Con personalidad jurídica,False
1209,700026604,,Confederacion de la Produccion y del Comercio,Monseñor Sótero Sanz 182 Providencia,Gremio Empresarial,Andrés Santa Cruz López,Defender y promover el derecho de propiedad privada; Defender y promover la libertad de empresa, entendida como el conjunto de condiciones que faciliten la creación y mantención de iniciativas empresariales y un marco económico, legal, tributario y labora,Confederación de Federaciones y Asociaciones Gremiales,,CONSEJO NACIONAL DE LA CULTURA Y LAS ARTES (CNCA),AV001,Con personalidad jurídica,False
1199,650903412,,Fundación Multitudes,Miraflores 113 Oficina 64,Fundación,Paulina Ibarra,Servicios de institutos de estudios, fundaciones, corporación de desarrollo,Fundación,,CONSEJO NACIONAL DE LA CULTURA Y LAS ARTES (CNCA),AV001,Con personalidad jurídica,False
904,654916608,,Fundación de Estudios Iberoamericanos Gonzalo Rojas,Fernandez Concha 700 Las Condes,Cultural,Gonazalo Rojas-May Ortiz,Culturales,Fundación.,,CONSEJO NACIONAL DE LA CULTURA Y LAS ARTES (CNCA),AV001,Con personalidad jurídica,
943,650774701,,Adcultura Asociación Gremial de Gestores Culturales de Chile,Balmaceda 1215, Santiago,Asociación Gremial,María Fernanda García,Gremiales y de interés de gestores culturales,Asociación gremial,,CONSEJO NACIONAL DE LA CULTURA Y LAS ARTES (CNCA),AV001,Con personalidad jurídica,
1295,767387202,,Bernstein y Woodward Comunicaciones Limitada,Augusto Leguía Norte 100, oficina 201, Las Condes, Santiago,Comunicaciones,Juan de Dios Larraín Matte,Servicios Comunicacionales, Promoción, Publicidad y Marketing,Sociedad Limitada,,SERVICIO NACIONAL DE LA MUJER (SERNAM),AT001,Con personalidad jurídica,True
1319,650376579,,Asociación Gremial de Generadoras de Chile,Avenida Presidente Riesco 5561 oficina 1803,Generación de Energía,René Muga Escobar,Promover la actividad de generación eléctrica en Chile,Asociación gremial,,SUBSECRETARÍA DEL INTERIOR,AB001,Con personalidad jurídica,False
1323,650903412,,Fundación Multitudes,Miraflores 113 Oficina 64,Fundación,Paulina Ibarra,Servicios de institutos de estudios, fundaciones, corporación de desarrollo,Fundación,,SUBSECRETARÍA DEL INTERIOR,AB001,Con personalidad jurídica,False
1262,767387202,,Bernstein y Woodward Comunicaciones Limitada,Augusto Leguía Norte 100, oficina 201, Las Condes, Santiago,Comunicaciones,Juan de Dios Larraín Matte,Servicios Comunicacionales, Promoción, Publicidad y Marketing,Sociedad Limitada,,SUBSECRETARÍA DEL INTERIOR,AB001,Con personalidad jurídica,True
1202,762042991,,ernesto evans espiñeira consultorias eirl,alvarez 1400,consultoria,ernesto evans,Consultora estratégica y asuntos publicos,EIRL,,SUBSECRETARÍA DEL INTERIOR,AB001,Con personalidad jurídica,True
1225,814589005,,Asociación de Bancos e Instituciones Financieras de Chile A.G.,Nueva Costanera N°4091, Vitacura.,Asociación Gremial,Jorge Awad Mehech,Asociación Gremial,Asociación Gremial,,SUBSECRETARÍA DEL INTERIOR,AB001,Con personalidad jurídica,False
1246,70017820k,,Cámara de Comercio de Santiago A.G,Monjitas N°392,Asociación Gremial,Peter Hill Dowd,Gremiales,Asociacion Gremial,,SUBSECRETARÍA DEL INTERIOR,AB001,Con personalidad jurídica,False
1159,700026604,,Confederacion de la Produccion y del Comercio,Monseñor Sótero Sanz 182 Providencia,Gremio Empresarial,Andrés Santa Cruz López,Defender y promover el derecho de propiedad privada; Defender y promover la libertad de empresa, entendida como el conjunto de condiciones que faciliten la creación y mantención de iniciativas empresariales y un marco económico, legal, tributario y labora,Confederación de Federaciones y Asociaciones Gremiales,,SUBSECRETARÍA DEL INTERIOR,AB001,Con personalidad jurídica,False
1164,769818200,,Azerta Comunicaciones,Américo Vespucio 1561, piso 6,Asesorías comunicacionales y Asuntos Públicos,Felipe Edwards Marín,Minería, energía, retail, agrícola, financiera, puertos, obras públicas, mercados regulados, entre otras materias.,Sociedad Anónima Cerrada,,SUBSECRETARÍA DEL INTERIOR,AB001,Con personalidad jurídica,True
1058,650308921,,Fundación Servicio Jesuita a Migrantes,Padre Alonso de Ovalle 1362, Santiago,Fundación,Orlando Contreras SJ,Fundación,Fundación,,SUBSECRETARÍA DEL INTERIOR,AB001,Con personalidad jurídica,
1060,73923400k,,Universidad Alberto Hurtado,Almirante Barroso 10, Santiago,Educación,Fernando Montes Matte,Educación Superior/Universidad,Organización sin fines de lucro,,SUBSECRETARÍA DEL INTERIOR,AB001,Con personalidad jurídica,
1061,650153464,,Corporación de Investigación y Desarrollo de la Sociedad y las Migraciones "Colectivo Sin Fronteras,Barnechea 320, Independencia, Santiago,Corporación,Patricia Loredo Chupán,Promoción y restitución de derechos de niños y niñas en situación de migración,Corporación sin fines de Lucro,,SUBSECRETARÍA DEL INTERIOR,AB001,Con personalidad jurídica,
1062,70990700k,,Universidad Diego Portales,Manuel Rodríguez Sur  415,Educación,Cristóbal MArín Correa,Educación Superior/Universidad,Organización sin Fines de Lucro,,SUBSECRETARÍA DEL INTERIOR,AB001,Con personalidad jurídica,
1065,609100478,,UNIVERSIDAD METROPOLITANA DE CIENCIAS DE LA EDUCACIÓN,AVENIDA JOSÉ PEDRO ALESSANDRI 540, ÑUÑOA,EDUCACIÓN,JAIME EUGENIO ESPINOSA ARAYA,EDUCACIÓN,INSTITUCIÓN DE EDUCACIÓN SUPERIOR,,SUBSECRETARÍA DEL INTERIOR,AB001,Con personalidad jurídica,
1066,605030009,,Empresa de Correos de Chile,Plaza de Armas 989, Piso 2, Correo Central,Comunicaciones,Franco Faccilongo Forno,Empresa del Estado,Gerente General,,SUBSECRETARÍA DEL INTERIOR,AB001,Con personalidad jurídica,
1067,942710003,,Enersis S.A.,Santa Rosa 76,Sociedad de Inversiones,Luigi Ferraris,Sociedad de Inversiones,Sociedad Anónima,,SUBSECRETARÍA DEL INTERIOR,AB001,Con personalidad jurídica,
1068,910810006,,Endesa,Santa Rosa 76,Generación de Energía Eléctrica,Valter Moro,Generación de Energía Eléctrica,Sociedad Anónima,,SUBSECRETARÍA DEL INTERIOR,AB001,Con personalidad jurídica,
879,,,SCAN CONTAINER,,,,REPRESENTANTE SCAN CHILE,,,SUBSECRETARÍA DEL INTERIOR,AB001,Sin personalidad jurídica ,
758,914400007,,Forestal Mininco S.A.,Av. Alemania 751, Los Angeles,Forestal,Francisco Ruiz Tagle,forestal,Sociedad Anónima,,SUBSECRETARÍA DEL INTERIOR,AB001,Con personalidad jurídica,
759,966378107,,Bosques Cautín,Rudecindo Ortega 1482    Temuco,Forestal,Pedro Jaramillo,Explotación de Bosques,Sociedad Anónima,,SUBSECRETARÍA DEL INTERIOR,AB001,Con personalidad jurídica,
760,96623220k,,VOLTERRA S.A.,Cochrane N° 361, Concepción,Plantación y Explotación de bosques, producción y comercialización de astillas de madera y productos forestales,Tadayoshi Kobayashi,Forestal,Sociedad Anónima,,SUBSECRETARÍA DEL INTERIOR,AB001,Con personalidad jurídica,
780,,,Unión Nacional de Trabajadoras y Trabajadores Públicos a Honorarios,,,,Defensa derechos laborales trabajadoras y Trabajores públicos a Honorarios,,,SUBSECRETARÍA DE DESARROLLO REGIONAL Y ADMINISTRATIVO (SUBDERE),AB002,Sin personalidad jurídica ,
881,650872312,,Comité de Vivienda La Rivera de Pitrufquén,Padre Hurtado N° 517, Piutrufquén,Comité de Vivienda,Lilian Gotschñich Oporto,Gestión de actividades del comité.,Organización Funcional,,SUBSECRETARÍA DE DESARROLLO REGIONAL Y ADMINISTRATIVO (SUBDERE),AB002,Con personalidad jurídica,
865,700049000,,Agrupación Nacional de Empleados Fiscales, ANEF.,Av. Libertador Bernardo O’Higgns Nº 1603,Asociación Gremial.,Raúl De la Puente,Representación de intereses de los empleados fiscales.,Asociación Gremial.,,SUBSECRETARÍA DE DESARROLLO REGIONAL Y ADMINISTRATIVO (SUBDERE),AB002,Con personalidad jurídica,
1263,767387202,,Bernstein y Woodward Comunicaciones Limitada,Augusto Leguía Norte 100, oficina 201, Las Condes, Santiago,Comunicaciones,Juan de Dios Larraín Matte,Servicios Comunicacionales, Promoción, Publicidad y Marketing,Sociedad Limitada,,SUBSECRETARÍA DE DESARROLLO REGIONAL Y ADMINISTRATIVO (SUBDERE),AB002,Con personalidad jurídica,True
1301,652968805,,FIDEN AG. Asociacion Gremial de Operadores, Fabricantes e importadores de entretenimientos electronicos,Altamirano N° 2301, segundo piso, oficina 06,Asociacion Gremial,Jaime Curihual Huircan,Propias de la Asociacion Gremial.,Asociacion Gremial.,,SUBSECRETARÍA DE DESARROLLO REGIONAL Y ADMINISTRATIVO (SUBDERE),AB002,Con personalidad jurídica,False
1265,767387202,,Bernstein y Woodward Comunicaciones Limitada,Augusto Leguía Norte 100, oficina 201, Las Condes, Santiago,Comunicaciones,Juan de Dios Larraín Matte,Servicios Comunicacionales, Promoción, Publicidad y Marketing,Sociedad Limitada,,SERVICIO ELECTORAL (SERVEL),AB006,Con personalidad jurídica,True
1144,650204271,,Fundación Ciudadano Inteligente,Holanda 895,Organización Sin Fines de Lucro,Rodrigo Mobarec,Organización Sin Fines de Lucro que fomenta la transparencia, acceso a la información pública, participación ciudadana y rendición de cuentas,Organización Sin Fines de Lucro,,SERVICIO ELECTORAL (SERVEL),AB006,Con personalidad jurídica,
1163,700026604,,Confederacion de la Produccion y del Comercio,Monseñor Sótero Sanz 182 Providencia,Gremio Empresarial,Andrés Santa Cruz López,Defender y promover el derecho de propiedad privada; Defender y promover la libertad de empresa, entendida como el conjunto de condiciones que faciliten la creación y mantención de iniciativas empresariales y un marco económico, legal, tributario y labora,Confederación de Federaciones y Asociaciones Gremiales,,SUBSECRETARÍA DE RELACIONES EXTERIORES,AC001,Con personalidad jurídica,False
1196,767326408,,Grupo Etcheberry,avenida Nueva costanera 4229 of 101,Asesorías a empresas,María Elena Etcheberry Court,Asesorías estratégicas,Limitada,,SUBSECRETARÍA DE RELACIONES EXTERIORES,AC001,Con personalidad jurídica,True
1266,767387202,,Bernstein y Woodward Comunicaciones Limitada,Augusto Leguía Norte 100, oficina 201, Las Condes, Santiago,Comunicaciones,Juan de Dios Larraín Matte,Servicios Comunicacionales, Promoción, Publicidad y Marketing,Sociedad Limitada,,SUBSECRETARÍA DE RELACIONES EXTERIORES,AC001,Con personalidad jurídica,True
1344,,12AI19151,Via Marina,5 cours Ferdinand de Lesseps,Via Marina,François Thiébaud,Ingeniería y construcción,Sociedad anónima francesa,,SUBSECRETARÍA DE RELACIONES EXTERIORES,AC001,Con personalidad jurídica,True
957,,12AI19151,Via Marina,5 cours Ferdinand de Lesseps,Via Marina,François Thiébaud,Ingeniería y construcción,Sociedad anónima francesa,,SUBSECRETARÍA DE RELACIONES EXTERIORES,AC001,Con personalidad jurídica,
958,,532 396 314,Via Marina,5 cours Ferdinand de Lesseps 92500 Rueil-Malmaison Francia,Via Marina,François Thiébaud,ingeniería y construcción,Sociedad anónima francesa,,SUBSECRETARÍA DE RELACIONES EXTERIORES,AC001,Con personalidad jurídica,
998,6520696006,,Empresas de Factoring Chile A.G.,Av. EL Bosque Norte 0440, Of. 407,Asociacion gremial,Sergio LOpez,Asociacion gremial,Asociacion gremial,,SUBSECRETARÍA DE ECONOMÍA,AH001,Con personalidad jurídica,
1000,652069606,,Empresas de Factoring Chile AG,Av. EL Bosque nOrte 0440 of. 407,Asociacion Gremial,Sergio LOpez,Asociacion Gremial,Asociacion Gremial,,SUBSECRETARÍA DE ECONOMÍA,AH001,Con personalidad jurídica,
659,97036000k,,Banco Santander Chile,bandera 140 santiago,banco comercial,claudio melandri,banco comercial,sociedad anonima,,SUBSECRETARÍA DE ECONOMÍA,AH001,Con personalidad jurídica,
704,63850609,,TATA CONSULTANCY SERVICES CHILE S.A.,Curicó N° 18 - Santiago,Asesores y consultores en informática,Alejandro Valenzuela Lagos,Empresa de servicios integrales de informática,Sociedad Anónima Cerrada,,SUBSECRETARÍA DE ECONOMÍA,AH001,Con personalidad jurídica,
705,763850609,,TATA CONSULTANCY SERVICES CHILE S.A.,Curicó N° 18 - Santiago,Asesores y consultores en informática,Alejandro Valenzuela Lagos,Empresa de servicios integrales de informática,Sociedad Anónima Cerrada,,SUBSECRETARÍA DE ECONOMÍA,AH001,Con personalidad jurídica,
1330,650376579,,Asociación Gremial de Generadoras de Chile,Avenida Presidente Riesco 5561, oficina 1803,Generación energía,René Muga,Promover el desarrollo de la actividad de generación de energía eléctrica en Chile,Asociación Gremial,,SUBSECRETARÍA DE ECONOMÍA,AH001,Con personalidad jurídica,False
1278,767387202,,Bernstein y Woodward Comunicaciones Limitada,Augusto Leguía Norte 100, oficina 201, Las Condes, Santiago,Comunicaciones,Juan de Dios Larraín Matte,Servicios Comunicacionales, Promoción, Publicidad y Marketing,Sociedad Limitada,,SUBSECRETARÍA DE ECONOMÍA,AH001,Con personalidad jurídica,True
1203,70470527,,ERNESTO EVANS ESPIÑEIRA CONSULTORIAS EIRL,ALVAREZ 1400,CONSULTORIAS,ERNESTO EVANS,CONSULTORIA Y ASUNTOS PUBLICOS,EIRL,,SUBSECRETARÍA DE ECONOMÍA,AH001,Con personalidad jurídica,True
1194,767326408,,Grupo Etcheberry,avenida Nueva costanera 4229 of 101,Asesorías a empresas,María Elena Etcheberry Court,Asesorías estratégicas,Limitada,,SUBSECRETARÍA DE ECONOMÍA,AH001,Con personalidad jurídica,True
1213,762042991,,ernesto evans espiñeira consultorias eirl,alvarez 1400,consultoria,ernesto evans,Consultora estratégica y asuntos publicos,EIRL,,SUBSECRETARÍA DE ECONOMÍA,AH001,Con personalidad jurídica,False
1218,76127547k,,Consultora Asuntos Públicos / Imaginaccion,Avenida Providencia 1760 piso 24, Providencia,Asuntos Públicos,Nelson Correa Arriagada,La compañía asesora en asuntos públicos relacionados con empresas o actividades reguladas por el Estado, tales como minería, energía, telecomunicaciones, medio ambiente, salud, transportes, servicios y otras actividades de interés,Sociedad de Responsabilidad Limitada,,SUBSECRETARÍA DE ECONOMÍA,AH001,Con personalidad jurídica,True
1245,710975000,,ASOCIACION DE ADMINISTRADORAS DE FONDOS DE PENSIONES A.G.,AVENIDA NUEVA PROVIDENCIA 2155 TORRE B PISO 14,ASOCIACION GREMIAL,FRANCISCO MARGOZZINI CAHIS,ASOCIACION GREMIAL,ASOCIACION GREMIAL,,SUBSECRETARÍA DE ECONOMÍA,AH001,Con personalidad jurídica,False
1253,70017820k,,Cámara de Comercio de Santiago A.G,Monjitas N°392,Asociación Gremial,Peter Hill Dowd,Gremiales,Asociacion Gremial,,SUBSECRETARÍA DE ECONOMÍA,AH001,Con personalidad jurídica,False
1230,814589005,,Asociación de Bancos e Instituciones Financieras de Chile A.G.,Nueva Costanera N°4091, Vitacura.,Asociación Gremial,Jorge Awad Mehech,Asociación Gremial,Asociación Gremial,,SUBSECRETARÍA DE ECONOMÍA,AH001,Con personalidad jurídica,False
1237,81458500k,,CÁMARA CHILENA DE LA CONSTRUCCIÓN A.G.,Marchant Pereira N° 10, tercer piso, comuna de Providencia, Región Metropolitana,ASOCIACIÓN GREMIAL,JORGE MAS FIGUEROA,ASOCIACIÓN GREMIAL,ASOCIACIÓN GREMIAL,,SUBSECRETARÍA DE ECONOMÍA,AH001,Con personalidad jurídica,False
1175,769818200,,Azerta Comunicaciones,Américo Vespucio 1561, piso 6,Asesorías comunicacionales y Asuntos Públicos,Felipe Edwards Marín,Minería, energía, retail, agrícola, financiera, puertos, obras públicas, mercados regulados, entre otras materias.,Sociedad Anónima Cerrada,,SUBSECRETARÍA DE ECONOMÍA,AH001,Con personalidad jurídica,True
1161,700026604,,Confederacion de la Produccion y del Comercio,Monseñor Sótero Sanz 182 Providencia,Gremio Empresarial,Andrés Santa Cruz López,Defender y promover el derecho de propiedad privada; Defender y promover la libertad de empresa, entendida como el conjunto de condiciones que faciliten la creación y mantención de iniciativas empresariales y un marco económico, legal, tributario y labora,Confederación de Federaciones y Asociaciones Gremiales,,SUBSECRETARÍA DE ECONOMÍA,AH001,Con personalidad jurídica,False
1098,76102955k,,Soprole Inversiones S.A.,Avenida Vitacura 4465, comuna de Vitacura, Santiago,VENTA AL POR MAYOR DE PRODUCTOS (LÁCTEOS) E INVERSIÓN Y RENTA EN CAPITALES MOVILIARIOS,Hugo Cobarrubias Lalanne,Empresa productora de lácteos,Sociedad Anónima Abierta,,SUBSECRETARÍA DE ECONOMÍA,AH001,Con personalidad jurídica,
1100,967665908,,Lota Protein S.A.,avenida Matta sin número, Lota, Región del Bio Bio,industrial pesquero,Simón Gundelach,captura, proceso y comercialización de productos del mar,sociedad anónima,,SUBSECRETARÍA DE ECONOMÍA,AH001,Con personalidad jurídica,
1279,767387202,,Bernstein y Woodward Comunicaciones Limitada,Augusto Leguía Norte 100, oficina 201, Las Condes, Santiago,Comunicaciones,Juan de Dios Larraín Matte,Servicios Comunicacionales, Promoción, Publicidad y Marketing,Sociedad Limitada,,SUBSECRETARÍA DE PESCA,AH002,Con personalidad jurídica,True
748,125965016,,Sindicato de Armadores de Caldera, III Región,Muelle Fiscal s/n, Caldera,Organización Sindical,Giuliano Reynuaba Salas,Pesca Artesanal,Sociedad Anónima,,SUBSECRETARÍA DE PESCA,AH002,Con personalidad jurídica,
749,71269736,,Sindicato de Armadores de Caldera, III Región,Muelle Fiscal s/n, Caldera,Organización Sindical,Giulliano Reynuaba,Pesca Artesanal,Sociedad Anónima,,SUBSECRETARÍA DE PESCA,AH002,Con personalidad jurídica,
750,5761501k,,CERCOPESCA, IV Región,Avenida Osandón N° 828, Coquimbo,cooperativa,Angel Cortés,Armadores cerqueros,cooperativa,,SUBSECRETARÍA DE PESCA,AH002,Con personalidad jurídica,
751,145897483,,CERCOPESCA, IV Región,Avenida Osandón 828, Coquimbo,cooperativa,Angel Cortes,Armadores cerqueros,cooperativa,,SUBSECRETARÍA DE PESCA,AH002,Con personalidad jurídica,
752,112913858,,SIPES MAFESA Coronel,Mackay 175, Lo Rojas, Coronel,Organización Gremial,Marcelo Segura,Pesca Artesanal,sociedad anonima,,SUBSECRETARÍA DE PESCA,AH002,Con personalidad jurídica,
1024,761728695,,Sociedad Productora de Eventos Echinuco Ltda,Nueva Costanera 4229 of 2016, Vitacura,Produccion de Eventos,Francisca Maira y Rosita Parsons,Evento Echinuco,Soc Ltda,,SUBSECRETARÍA DE PESCA,AH002,Con personalidad jurídica,
1027,710344000,,Asociación de Industriales Pesqueros, ASIPES,O Higgins 940 of 804 Concepcion,Asociación gremial,Luis Felipe Moncada Arroyo,Representa gremialmente a las empresas socias de la industria pesquera de la zona centro sur,Asociación gremial,,SUBSECRETARÍA DE PESCA,AH002,Con personalidad jurídica,
1028,942710003,,Enersis S.A.,Santa Rosa 76,Sociedad de Inversiones,Luigi Ferraris,Sociedad de Inversiones,Sociedad Anónima,,SUBSECRETARÍA DE PESCA,AH002,Con personalidad jurídica,
1029,910810006,,Endesa,Santa Rosa 76,Generación de energía eléctrica,Valter Moro,Generación de energía eléctrica,S.A.,,SUBSECRETARÍA DE PESCA,AH002,Con personalidad jurídica,
1016,700243001,,Sociedad de Fomento Fabril F.G.,Av. Andrés Bello 2777, Piso 3, Las Condes,Actividades de otras asociaciones N. C. P.,Jorge Ortúzar Santa María,Ferderación Gremial,Federación Gremial,,SUBSECRETARÍA DE HACIENDA,AE001,Con personalidad jurídica,
713,53472400,,Jorge Mas,Marchant Pereira 10. piso 3,Asociación Gremial,Sergio Cavagnaro Santa Marïa,Asociación Gremial,Asociación Gremial,,SUBSECRETARÍA DE HACIENDA,AE001,Con personalidad jurídica,
719,81458500k,,Camara Chilena de la Construcción,Marchant Pereira,Construcción,Jorge Mas Figueroa,Gremio,Asociación Gremial,,SUBSECRETARÍA DE HACIENDA,AE001,Con personalidad jurídica,
1275,767387202,,Bernstein y Woodward Comunicaciones Limitada,Augusto Leguía Norte 100, oficina 201, Las Condes, Santiago,Comunicaciones,Juan de Dios Larraín Matte,Servicios Comunicacionales, Promoción, Publicidad y Marketing,Sociedad Limitada,,SUBSECRETARÍA DE HACIENDA,AE001,Con personalidad jurídica,True
1327,650376579,,Asociación Gremial de Generadoras de Chile,Avenida Presidente Riesco 5561, oficina 1803,Generación energía,René Muga,Promover el desarrollo de la actividad de generación de energía eléctrica en Chile,Asociación Gremial,,SUBSECRETARÍA DE HACIENDA,AE001,Con personalidad jurídica,False
1165,769818200,,Azerta Comunicaciones,Américo Vespucio 1561, piso 6,Asesorías comunicacionales y Asuntos Públicos,Felipe Edwards Marín,Minería, energía, retail, agrícola, financiera, puertos, obras públicas, mercados regulados, entre otras materias.,Sociedad Anónima Cerrada,,SUBSECRETARÍA DE HACIENDA,AE001,Con personalidad jurídica,True
1105,816989000,,Pontificia Universidad Católica de Chile,Avenida Libertador Bernardo OHiggins 340, Santiago,Institución de Educación Superior,Ignacio Sánchez,Pro rector,Institución de Educación Superior,,SUBSECRETARÍA DE HACIENDA,AE001,Con personalidad jurídica,
1106,,814968006,Hogar de Cristo,Hogar de Cristo 3812, Estación Central,Institución de Caridad,José Miguel Musalem,Presidente Directorio,Organismo no Gubernamental,,SUBSECRETARÍA DE HACIENDA,AE001,Con personalidad jurídica,
1158,700026604,,Confederacion de la Produccion y del Comercio,Monseñor Sótero Sanz 182 Providencia,Gremio Empresarial,Andrés Santa Cruz López,Defender y promover el derecho de propiedad privada; Defender y promover la libertad de empresa, entendida como el conjunto de condiciones que faciliten la creación y mantención de iniciativas empresariales y un marco económico, legal, tributario y labora,Confederación de Federaciones y Asociaciones Gremiales,,SUBSECRETARÍA DE HACIENDA,AE001,Con personalidad jurídica,False
1183,767326408,,Grupo Etcheberry,avenida Nueva costanera 4229 of 101,Asesorías a empresas,María Elena Etcheberry Court,Asesorías estratégicas,Limitada,,SUBSECRETARÍA DE HACIENDA,AE001,Con personalidad jurídica,True
1227,814589005,,Asociación de Bancos e Instituciones Financieras de Chile A.G.,Nueva Costanera N°4091, Vitacura.,Asociación Gremial,Jorge Awad Mehech,Asociación Gremial,Asociación Gremial,,SUBSECRETARÍA DE HACIENDA,AE001,Con personalidad jurídica,False
1222,76127547k,,Consultora Asuntos Públicos / Imaginaccion,Avenida Providencia 1760 piso 24, Providencia,Asuntos Públicos,Nelson Correa Arriagada,La compañía asesora en asuntos públicos relacionados con empresas o actividades reguladas por el Estado, tales como minería, energía, telecomunicaciones, medio ambiente, salud, transportes, servicios y otras actividades de interés,Sociedad de Responsabilidad Limitada,,SUBSECRETARÍA DE HACIENDA,AE001,Con personalidad jurídica,True
1250,70017820k,,Cámara de Comercio de Santiago A.G,Monjitas N°392,Asociación Gremial,Peter Hill Dowd,Gremiales,Asociacion Gremial,,SUBSECRETARÍA DE HACIENDA,AE001,Con personalidad jurídica,False
1243,814460002,,Sociedad Nacional de Minería F.G.,Avenida Apoquindo 3.000, 5° piso, Las Condes, Santiago.,Gremio minero,Alberto Salas Muñoz,Representar  a sus afiliados y promover, coordinar y dirigir las acciones que éstos lleven a cabo en relación con la racionalización, desarrollo y protección de la actividad minera y de las conexas a dicha actividad.,Federación Gremial,,SUBSECRETARÍA DE HACIENDA,AE001,Con personalidad jurídica,False
1244,710975000,,ASOCIACION DE ADMINISTRADORAS DE FONDOS DE PENSIONES A.G.,AVENIDA NUEVA PROVIDENCIA 2155 TORRE B PISO 14,ASOCIACION GREMIAL,FRANCISCO MARGOZZINI CAHIS,ASOCIACION GREMIAL,ASOCIACION GREMIAL,,SUBSECRETARÍA DE HACIENDA,AE001,Con personalidad jurídica,False
1235,81458500k,,CÁMARA CHILENA DE LA CONSTRUCCIÓN A.G.,Marchant Pereira N° 10, tercer piso, comuna de Providencia, Región Metropolitana,ASOCIACIÓN GREMIAL,JORGE MAS FIGUEROA,ASOCIACIÓN GREMIAL,ASOCIACIÓN GREMIAL,,CONSEJO DE DEFENSA DEL ESTADO (CDE),AX001,Con personalidad jurídica,False
