IDEntidad,Rut,CodigoInt,nombre,domicilio,giro,representante,actividades,naturaleza,administrador,institucion,idportal,tipoEntidad,remunerado
1320,650376579,,Asociación Gremial de Generadoras de Chile,Avenida Presidente Riesco 5561, oficina 1803,Generación energía,René Muga,Promover el desarrollo de la actividad de generación de energía eléctrica en Chile,Asociación Gremial,,SUBSECRETARÍA DEL TRABAJO,AL001,Con personalidad jurídica,False
1286,767387202,,Bernstein y Woodward Comunicaciones Limitada,Augusto Leguía Norte 100, oficina 201, Las Condes, Santiago,Comunicaciones,Juan de Dios Larraín Matte,Servicios Comunicacionales, Promoción, Publicidad y Marketing,Sociedad Limitada,,SUBSECRETARÍA DEL TRABAJO,AL001,Con personalidad jurídica,True
1340,658445707,,Federación de Sindicatos de Metro S.A,Av. Lib. Bdo. OHiggins 1632 of. 401-402 piso 4,Otras Actividades Sindicales,Eujenio de la Cruz Valenzuela Arriagada,912000 Otras Actividades Sindicales,Federación de Sindicatos,,SUBSECRETARÍA DEL TRABAJO,AL001,Con personalidad jurídica,False
1342,965652701,,DIPRALSA S.A.,LAS ARAUCARIAS 9090 QUILICURA SANTIAGO,DISTRIBUIDORA D ALIMENTOS,YERKO MARINOVIC,DISTRIBUIDORA DE ALIMENTOS,SOCIEDAD ANONIMA,,SUBSECRETARÍA DEL TRABAJO,AL001,Con personalidad jurídica,True
1255,70017820k,,Cámara de Comercio de Santiago A.G,Monjitas N°392,Asociación Gremial,Peter Hill Dowd,Gremiales,Asociacion Gremial,,SUBSECRETARÍA DEL TRABAJO,AL001,Con personalidad jurídica,False
1232,814589005,,Asociación de Bancos e Instituciones Financieras de Chile A.G.,Nueva Costanera N°4091, Vitacura.,Asociación Gremial,Jorge Awad Mehech,Asociación Gremial,Asociación Gremial,,SUBSECRETARÍA DEL TRABAJO,AL001,Con personalidad jurídica,False
1095,605030009,,Empresa de Correos de Chile,Plaza de Armas 989, Piso 2, Correo Central,Comunicaciones,Franco Faccilongo Forno,Empresa del Estado,Gerente General,,SUBSECRETARÍA DEL TRABAJO,AL001,Con personalidad jurídica,
1179,769818200,,Azerta Comunicaciones,Américo Vespucio 1561, piso 6,Asesorías comunicacionales y Asuntos Públicos,Felipe Edwards Marín,Minería, energía, retail, agrícola, financiera, puertos, obras públicas, mercados regulados, entre otras materias.,Sociedad Anónima Cerrada,,SUBSECRETARÍA DEL TRABAJO,AL001,Con personalidad jurídica,True
1160,700026604,,Confederacion de la Produccion y del Comercio,Monseñor Sótero Sanz 182 Providencia,Gremio Empresarial,Andrés Santa Cruz López,Defender y promover el derecho de propiedad privada; Defender y promover la libertad de empresa, entendida como el conjunto de condiciones que faciliten la creación y mantención de iniciativas empresariales y un marco económico, legal, tributario y labora,Confederación de Federaciones y Asociaciones Gremiales,,SUBSECRETARÍA DEL TRABAJO,AL001,Con personalidad jurídica,False
1057,650904354,,Fundación Médicos S.O.S.,San Sebastian 2909 Depto 604,Fundación Sin Fines de Lucro,Guillermo Ramirez Sneberger,Fundación dedicada a llevar salud, mediante grupos de médicos voluntarios, a zonas aisladas, de catástrofe  y población en riesgo social,Fundación Sin Fines de Lucro,,SUBSECRETARÍA DE SALUD PÚBLICA ,AO001,Con personalidad jurídica,
1184,767326408,,Grupo Etcheberry,avenida Nueva costanera 4229 of 101,Asesorías a empresas,María Elena Etcheberry Court,Asesorías estratégicas,Limitada,,SUBSECRETARÍA DE SALUD PÚBLICA ,AO001,Con personalidad jurídica,True
1053,826217006,,Colegio Médico de Chile,Esmeralda 678 - Santiago,Colegio Profesional,Enrique Paris Mancilla,Asociacion Gremial,Asociación Gremial,,SUBSECRETARÍA DE SALUD PÚBLICA ,AO001,Con personalidad jurídica,
1054,,,Sociedad Chilena de Oftalmología,,,,Actividad Gremial,,,SUBSECRETARÍA DE SALUD PÚBLICA ,AO001,Sin personalidad jurídica ,
1182,769818200,,Azerta Comunicaciones,Américo Vespucio 1561, piso 6,Asesorías comunicacionales y Asuntos Públicos,Felipe Edwards Marín,Minería, energía, retail, agrícola, financiera, puertos, obras públicas, mercados regulados, entre otras materias.,Sociedad Anónima Cerrada,,SUBSECRETARÍA DE SALUD PÚBLICA ,AO001,Con personalidad jurídica,True
1221,76127547k,,Consultora Asuntos Públicos / Imaginaccion,Avenida Providencia 1760 piso 24, Providencia,Asuntos Públicos,Nelson Correa Arriagada,La compañía asesora en asuntos públicos relacionados con empresas o actividades reguladas por el Estado, tales como minería, energía, telecomunicaciones, medio ambiente, salud, transportes, servicios y otras actividades de interés,Sociedad de Responsabilidad Limitada,,SUBSECRETARÍA DE SALUD PÚBLICA ,AO001,Con personalidad jurídica,True
1207,700026604,,Confederacion de la Produccion y del Comercio,Monseñor Sótero Sanz 182 Providencia,Gremio Empresarial,Andrés Santa Cruz López,Defender y promover el derecho de propiedad privada; Defender y promover la libertad de empresa, entendida como el conjunto de condiciones que faciliten la creación y mantención de iniciativas empresariales y un marco económico, legal, tributario y labora,Confederación de Federaciones y Asociaciones Gremiales,,SUBSECRETARÍA DE SALUD PÚBLICA ,AO001,Con personalidad jurídica,False
1335,761033867,,NEWLINK CHILE S.A.,La Concepción 191 oficina 1203, Providencia,Asesorías y servicios de relaciones públicas, periodismo y marketing,Paul Venturino Del Canto,Asesorías comunicacionales y asuntos públicos,Sociedad anónima,,SUBSECRETARÍA DE SALUD PÚBLICA ,AO001,Con personalidad jurídica,True
1290,767387202,,Bernstein y Woodward Comunicaciones Limitada,Augusto Leguía Norte 100, oficina 201, Las Condes, Santiago,Comunicaciones,Juan de Dios Larraín Matte,Servicios Comunicacionales, Promoción, Publicidad y Marketing,Sociedad Limitada,,SUBSECRETARÍA DE SALUD PÚBLICA ,AO001,Con personalidad jurídica,True
1312,733626003,,MOVIMIENTO POR LA DIVERSIDAD SEXUAL MUMS / CENTRO DE ESTUDIOS DE LA SEXUALIDAD ONG CES,SANTA MÓNICA 2317,ONG,MARCELO LEIVA GUTIERREZ,ORGANIZACIÓN NO GUBERNAMENTAL,ORGANIZACIÓN SIN FINES DE LUCRO,,SUBSECRETARÍA DE SALUD PÚBLICA ,AO001,Con personalidad jurídica,False
1325,650903412,,Fundación Multitudes,Miraflores 113 Oficina 64,Fundación,Paulina Ibarra,Servicios de institutos de estudios, fundaciones, corporación de desarrollo,Fundación,,SUBSECRETARÍA DE MINERÍA,AS001,Con personalidad jurídica,False
1294,767387202,,Bernstein y Woodward Comunicaciones Limitada,Augusto Leguía Norte 100, oficina 201, Las Condes, Santiago,Comunicaciones,Juan de Dios Larraín Matte,Servicios Comunicacionales, Promoción, Publicidad y Marketing,Sociedad Limitada,,SUBSECRETARÍA DE MINERÍA,AS001,Con personalidad jurídica,True
1258,700026604,,Confederacion de la Produccion y del Comercio,Monseñor Sótero Sanz 182 Providencia,Gremio Empresarial,Andrés Santa Cruz López,Defender y promover el derecho de propiedad privada; Defender y promover la libertad de empresa, entendida como el conjunto de condiciones que faciliten la creación y mantención de iniciativas empresariales y un marco económico, legal, tributario y labora,Confederación de Federaciones y Asociaciones Gremiales,,SUBSECRETARÍA DE MINERÍA,AS001,Con personalidad jurídica,False
1212,743255003,,Consejo Minero,Apoquindo 3500 Piso 7, Las Condes,Gremio empresarial,Joaquín Villarino,Impulsar el desarrollo competitivo y sustentable de la minería chilena, contribuyendo al bienestar del país,Asociación gremial,,SUBSECRETARÍA DE MINERÍA,AS001,Con personalidad jurídica,False
1220,814460002,,Sociedad Nacional de Minería F.G.,Avenida Apoquindo 3.000, 5° piso, Las Condes, Santiago.,Gremio minero,Alberto Salas Muñoz,Representar  a sus afiliados y promover, coordinar y dirigir las acciones que éstos lleven a cabo en relación con la racionalización, desarrollo y protección de la actividad minera y de las conexas a dicha actividad.,Federación Gremial,,SUBSECRETARÍA DE MINERÍA,AS001,Con personalidad jurídica,False
1215,76127547k,,Consultora Asuntos Públicos / Imaginaccion,Avenida Providencia 1760 piso 24, Providencia,Asuntos Públicos,Nelson Correa Arriagada,La compañía asesora en asuntos públicos relacionados con empresas o actividades reguladas por el Estado, tales como minería, energía, telecomunicaciones, medio ambiente, salud, transportes, servicios y otras actividades de interés,Sociedad de Responsabilidad Limitada,,SUBSECRETARÍA DE MINERÍA,AS001,Con personalidad jurídica,True
1185,769818200,,Azerta Comunicaciones,Américo Vespucio 1561, piso 6,Asesorías comunicacionales y Asuntos Públicos,Felipe Edwards Marín,Minería, energía, retail, agrícola, financiera, puertos, obras públicas, mercados regulados, entre otras materias.,Sociedad Anónima Cerrada,,SUBSECRETARÍA DE MINERÍA,AS001,Con personalidad jurídica,True
818,760283452,,Kinross Minera Chile Ltda.,Cerro Colorado 52 40 Torre II Piso 18,Mineria,Ximena Matas,Operaciones mineras,Sociedad Limitada,,SUBSECRETARÍA DE MINERÍA,AS001,Con personalidad jurídica,
821,768601402,,Herencia Resources S.A.,Burgos 80 Piso 12,Exploracion Minera,John Porter,Mineria,Sociedad Anonima,,SUBSECRETARÍA DE MINERÍA,AS001,Con personalidad jurídica,
822,765812208,,Pedro Cardenas,Cerro Colorado 5240 Torres del Parque II Piso 9 Oficina A,Apoyo Servicios Gerenciales,Andres Guzman-Roberto Alarcon-Gerardo Fernandez,Apoyo Servicios Generales Yamana Chile Ltda.,Sociedad responsabilidad  LTda,,SUBSECRETARÍA DE MINERÍA,AS001,Con personalidad jurídica,
825,,,Iniciativa Agua y Medioambiente,,,,Dialogo multisectorial,,,SUBSECRETARÍA DE MINERÍA,AS001,Sin personalidad jurídica ,
1017,770034108,,SCM White Mountain Titanium,Augusto Leguia Norte 100 piso 14, Las Condes,Exploraciones mineras,Francisco Rojas Ohmke,Producción minera,Sociedad Contractual Minera,,SUBSECRETARÍA DE MINERÍA,AS001,Con personalidad jurídica,
1018,760734772,,Puerto Desierto S.A.,Edificio Valle de Copiapó- Calle Colipí 570, oficina 504-Copiapó,Ingeniería y Construcción,Xin Guo, General Manager,Ingeniería y Construcción,S.A.,,SUBSECRETARÍA DE MINERÍA,AS001,Con personalidad jurídica,
1020,760586846,,SMEC,Rosario Norte 555,Asesorías,Ronald Galisky,Actividades de Asesoriamiento Empresarial,Sociedad Limitada,,SUBSECRETARÍA DE MINERÍA,AS001,Con personalidad jurídica,
1022,850666008,,Rockwood Litio Ltda,Sector La Negra S/N, lotes 1 y 2, Antofagasta.,Explotación de otras minas y canteras,Stephen Elgueta,Minería,Sociedad Limitada,,SUBSECRETARÍA DE MINERÍA,AS001,Con personalidad jurídica,
1009,778172305,,Representaciones E.L. y Cia. Ltda.,Nueva Providencia 2155 Of. 601-C,Representaciones,Eduardo Lathrop Rojas,Representaciones,Sociedad Limitada,,SUBSECRETARÍA DE MINERÍA,AS001,Con personalidad jurídica,
1012,761726293,,MINERA PLAYA VERDE LTDA.,EBRO 2740, OFIC 603, LAS CONDES, SANTIAGO,MINERO,JUAN HERIBERTO PASTEN CASTILLO,MINERIA,SOCIEDAD LIMITADA,,SUBSECRETARÍA DE MINERÍA,AS001,Con personalidad jurídica,
1015,,,Junta de Vecinos "La Trilla" Pelluhue,,,,JUNTA DE VECINOS,,,SUBSECRETARIA DE VIVIENDA Y URBANISMO,AP001,Sin personalidad jurídica ,
938,657091901,,Comité de allegados Don Bosco,Pje. Padre Miguel Woodward 5805,Comité de vivienda,Rafael Soto Contreras,Promover soluciones habitacionales a sus socios,Organización social,,SUBSECRETARIA DE VIVIENDA Y URBANISMO,AP001,Con personalidad jurídica,
965,721600009,,Vicaría Pastoral Social y Trabajadores,catedral 1063,religioso,Andrés Moro Vargas,sociales,servicios,,SUBSECRETARIA DE VIVIENDA Y URBANISMO,AP001,Con personalidad jurídica,
973,650819322,,Asociación Alcaldes Mapuches,Comercio #206, Renaico,Asociativismo,Juan Carlos Reinao,Sociales,Asociación,,SUBSECRETARIA DE VIVIENDA Y URBANISMO,AP001,Con personalidad jurídica,
922,763348709,,CONSULTORA SANTO DOMINGO LTDA,ARZOBISPO VALDIVIESO 244, LLO LLEO, SAN ANTONIO,EGIS,LILIAN LEMA QUIROZ,CONSULTORA,SOCIEDAD LIMITADA,,SUBSECRETARIA DE VIVIENDA Y URBANISMO,AP001,Con personalidad jurídica,
887,970300007,,BancoEstao,alameda 1111, santiago,Bancario,Jessica Lopez Saffie,Financieras,Sociedad Anonima,,SUBSECRETARIA DE VIVIENDA Y URBANISMO,AP001,Con personalidad jurídica,
888,,SIN INFORMAR,BAURPARKASSE SCHWABISCH HALL AG,Hagenbacher Ring 130, 74523 Schwäbisch Hall,Financiero,SIN INFORMAR,Cooperativa,Institución Financiera,,SUBSECRETARIA DE VIVIENDA Y URBANISMO,AP001,Con personalidad jurídica,
889,,SIN INFORMAR,BAURPARKASSE SCHWABISCH HALL AG,Unterlimpurger Str. 10/2, 74523 Schawäbisch Hall,Financiero,SIN INFORMAR,Cooperativa,Institución Financiera,,SUBSECRETARIA DE VIVIENDA Y URBANISMO,AP001,Con personalidad jurídica,
890,,SIN INFORMAR,BAURPARKASSE SCHWABISCH HALL AG,Schumannstrabe 18, 63225 Langen,Financiero,SIN INFORMAR,Cooperativa,Institución Financiera,,SUBSECRETARIA DE VIVIENDA Y URBANISMO,AP001,Con personalidad jurídica,
891,,SIN INFORMAR,BAURPARKASSE SCHWABISCH HALL AG,Landturm 32, 74572 Herrentierbach,Financiero,SIN INFORMAR,Cooperativa,Institución Financiera,,SUBSECRETARIA DE VIVIENDA Y URBANISMO,AP001,Con personalidad jurídica,
892,,,INVERSIONES Y ASESORIAS LATRI LTDA,Enrique Foster Sur 260, Las Condes,Limitada,SIN INFORMAR,Inversiones y Asesorias,Limitada,,SUBSECRETARIA DE VIVIENDA Y URBANISMO,AP001,Con personalidad jurídica,
837,658876104,,Comité de Vivienda Villa El Estero,Nueva Dos 670, Cholchol,Comité de Vivienda,Liliana Breve Viveros,Promover soluciones habitacionales a sus socios,Organización Social,,SUBSECRETARIA DE VIVIENDA Y URBANISMO,AP001,Con personalidad jurídica,
839,650597141,,Comité de Vivienda Los Kiwis,Pérez 449, Cholchol,Comité de Vivienda,Luis Levio Lienqueo,Promover soluciones habitacionales a sus socios,Organización Social,,SUBSECRETARIA DE VIVIENDA Y URBANISMO,AP001,Con personalidad jurídica,
841,650628497,,Comité de vivienda Las Violetas,Lazcano 580, Cholchol,Comité de vivienda,Consuelo Astudillo Llevul,Promover soluciones habitacionales a sus socios,Organización social,,SUBSECRETARIA DE VIVIENDA Y URBANISMO,AP001,Con personalidad jurídica,
842,650806530,,Comité de vivienda Los Copihues,Prat 84, Cholchol,Comité de vivienda,Claudia Fontena Vera,Promover soluciones habitacionales a sus socios,Organización social,,SUBSECRETARIA DE VIVIENDA Y URBANISMO,AP001,Con personalidad jurídica,
655,650796845,,Grupo Habitacional Bicentenario,Av. Buenos Aires 1, San Clemente,Social,Nataly Cornejo Briones,Promover soluciones habitacionales a sus socios,Organización social,,SUBSECRETARIA DE VIVIENDA Y URBANISMO,AP001,Con personalidad jurídica,
656,650908031,,Comité Habitacional Don Fermin I,Alejandro Cruz 151, San Clemente,Organización Social,Sandra Muñoz Rioseco,Promover soluciones habitacionales a sus socios,Organización Social,,SUBSECRETARIA DE VIVIENDA Y URBANISMO,AP001,Con personalidad jurídica,
694,609100001,,UNIVERSIDAD DE CHILE,ALAMEDA BERNARDO O´HIGGINS S/N,UNIVERSIDAD,ENNIO VIVALDI,EDUCACIONALES,CORPORACION,,SUBSECRETARIA DE VIVIENDA Y URBANISMO,AP001,Con personalidad jurídica,
1187,769818200,,Azerta Comunicaciones,Américo Vespucio 1561, piso 6,Asesorías comunicacionales y Asuntos Públicos,Felipe Edwards Marín,Minería, energía, retail, agrícola, financiera, puertos, obras públicas, mercados regulados, entre otras materias.,Sociedad Anónima Cerrada,,SUBSECRETARIA DE VIVIENDA Y URBANISMO,AP001,Con personalidad jurídica,True
1210,700026604,,Confederacion de la Produccion y del Comercio,Monseñor Sótero Sanz 182 Providencia,Gremio Empresarial,Andrés Santa Cruz López,Defender y promover el derecho de propiedad privada; Defender y promover la libertad de empresa, entendida como el conjunto de condiciones que faciliten la creación y mantención de iniciativas empresariales y un marco económico, legal, tributario y labora,Confederación de Federaciones y Asociaciones Gremiales,,SUBSECRETARIA DE VIVIENDA Y URBANISMO,AP001,Con personalidad jurídica,False
1191,767326408,,Grupo Etcheberry,avenida Nueva costanera 4229 of 101,Asesorías a empresas,María Elena Etcheberry Court,Asesorías estratégicas,Limitada,,SUBSECRETARIA DE VIVIENDA Y URBANISMO,AP001,Con personalidad jurídica,True
1238,81458500k,,CÁMARA CHILENA DE LA CONSTRUCCIÓN A.G.,Marchant Pereira N° 10, tercer piso, comuna de Providencia, Región Metropolitana,ASOCIACIÓN GREMIAL,JORGE MAS FIGUEROA,ASOCIACIÓN GREMIAL,ASOCIACIÓN GREMIAL,,SUBSECRETARIA DE VIVIENDA Y URBANISMO,AP001,Con personalidad jurídica,False
1291,767387202,,Bernstein y Woodward Comunicaciones Limitada,Augusto Leguía Norte 100, oficina 201, Las Condes, Santiago,Comunicaciones,Juan de Dios Larraín Matte,Servicios Comunicacionales, Promoción, Publicidad y Marketing,Sociedad Limitada,,SUBSECRETARIA DE VIVIENDA Y URBANISMO,AP001,Con personalidad jurídica,True
1343,965252002,,covip,huerfanos 886, oficina 1119, santiago,viviendas sociales,ramon santelices,gremiales,sociedad anonima cerrada,,SUBSECRETARIA DE VIVIENDA Y URBANISMO,AP001,Con personalidad jurídica,False
1337,761033867,,NEWLINK CHILE S.A.,La Concepción 191 oficina 1203, Providencia,Asesorías y servicios de relaciones públicas, periodismo y marketing,Paul Venturino Del Canto,Asesorías comunicacionales y asuntos públicos,Sociedad anónima,,SUBSECRETARIA DE VIVIENDA Y URBANISMO,AP001,Con personalidad jurídica,True
1332,761033867,,NEWLINK CHILE S.A.,La Concepción 191 oficina 1203, Providencia,Asesorías y servicios de relaciones públicas, periodismo y marketing,Paul Venturino Del Canto,Asesorías comunicacionales y asuntos públicos,Sociedad anónima,,SUBSECRETARIA DE TRANSPORTES,AN001,Con personalidad jurídica,True
1288,767387202,,Bernstein y Woodward Comunicaciones Limitada,Augusto Leguía Norte 100, oficina 201, Las Condes, Santiago,Comunicaciones,Juan de Dios Larraín Matte,Servicios Comunicacionales, Promoción, Publicidad y Marketing,Sociedad Limitada,,SUBSECRETARIA DE TRANSPORTES,AN001,Con personalidad jurídica,True
1192,767326408,,Grupo Etcheberry,avenida Nueva costanera 4229 of 101,Asesorías a empresas,María Elena Etcheberry Court,Asesorías estratégicas,Limitada,,SUBSECRETARIA DE TRANSPORTES,AN001,Con personalidad jurídica,True
1206,700026604,,Confederacion de la Produccion y del Comercio,Monseñor Sótero Sanz 182 Providencia,Gremio Empresarial,Andrés Santa Cruz López,Defender y promover el derecho de propiedad privada; Defender y promover la libertad de empresa, entendida como el conjunto de condiciones que faciliten la creación y mantención de iniciativas empresariales y un marco económico, legal, tributario y labora,Confederación de Federaciones y Asociaciones Gremiales,,SUBSECRETARIA DE TRANSPORTES,AN001,Con personalidad jurídica,False
1181,769818200,,Azerta Comunicaciones,Américo Vespucio 1561, piso 6,Asesorías comunicacionales y Asuntos Públicos,Felipe Edwards Marín,Minería, energía, retail, agrícola, financiera, puertos, obras públicas, mercados regulados, entre otras materias.,Sociedad Anónima Cerrada,,SUBSECRETARIA DE TRANSPORTES,AN001,Con personalidad jurídica,True
767,947270001,,Gtd Grupo Teleductos S.A.,Moneda 920, piso 11, Santiago,Telecomunicaciones,Alberto José Bezanilla Donoso,Telecomunicaciones,Sociedad Anónima,,SUBSECRETARIA DE TRANSPORTES,AN001,Con personalidad jurídica,
768,902990003,,Telefónica del Sur S.A.,San Carlos 107, ciudad y comuna de Valdivia,Telecomunicaciones,Juan Carlos Velenzuela Herrera,Telecomunicaciones,Sociedad Anónima,,SUBSECRETARIA DE TRANSPORTES,AN001,Con personalidad jurídica,
775,966824301,,Motorola Solutions Chile S.A.,Av. Nueva Tajamar 481, Torre Norte, Oficina 1702, Edificio World Trade Center, Las Condes,Telecomunicaciones,Gabriel Contesse Orellana,Telecomunicaciones,S.A.,,SUBSECRETARIA DE TRANSPORTES,AN001,Con personalidad jurídica,
776,774067205,,Regulación & Mercados - GC,Suecia 15, Of 74, Providencia, Santiago,Consultoría,Cristian Rojas Pérez,Consultoría,Ltda,,SUBSECRETARIA DE TRANSPORTES,AN001,Con personalidad jurídica,
845,,Pasaporte,TomTom Brasil Comércio e Marketing de Soluções de Navegação Ltda.,São Paulo, Brasil,NA,Marcelo Dias Fernandes,Sistemas de navegación y monitoreo de trafego,Sociedad limitad.,,SUBSECRETARIA DE TRANSPORTES,AN001,Con personalidad jurídica,
847,2021002098,,Exportkreditnämnden / EKN,Kungsgatan 36, 103 61 Estocolmo, Suecia,Financiero,Karin Apelman (Directora General),Asegurar empresas exportadoras y bancos contra el riesgo de impago en operaciones de exportación,Entidad pública sueca,,SUBSECRETARIA DE TRANSPORTES,AN001,Con personalidad jurídica,
848,,2021002098,Exportkreditnämnden,Kungsgatan 36, 103 61 Estocolmo, Suecia,Financiero,Karin Apelman (Directora General),Asegurar empresas exportadoras y bancos contra el riesgo de impago en operaciones de exportación,Entidad pública sueca,,SUBSECRETARIA DE TRANSPORTES,AN001,Con personalidad jurídica,
849,699058009,,Embajada de Suecia,Av. Nueva Providencia 2353, Piso 4, Santiago, Chile,Diplomático,Jakob Kiefer (Embajador),Representación Diplomática de Suecia en Chile,Entidad pública sueca - Embajada de Suecia en Chile,,SUBSECRETARIA DE TRANSPORTES,AN001,Con personalidad jurídica,
850,760324590,,Sociedad de Capacitación Structuralia Chile limitada,Cerro el Plomo 5931 oficina 805 Las Condes,Servicios de Capacitación,Andrés Salvador Hidalgo Escandell,Capacitación,Sociedad Limitada,,SUBSECRETARIA DE TRANSPORTES,AN001,Con personalidad jurídica,
851,760624942,,systech chile ltda,Los Miltares 4290 piso 8,servicios de inspeccion vehicular,Rigoberto Bahamonde,Inspeccion tecnica vehicular,Sociedad Limitada,,SUBSECRETARIA DE TRANSPORTES,AN001,Con personalidad jurídica,
876,969136007,,Transap,Cerro El plomo 5680, oficina 302, las Condes,Transporte,Claudio Cid,Transporte Ferroviario,S.A.,,SUBSECRETARIA DE TRANSPORTES,AN001,Con personalidad jurídica,
901,70017820k,,Cámara de Comercio de Santiago,Monjitas 392 Piso 18,Asociación Gremial,Peter Hill Dowd,Gremiales,Asociación Gremial,,SUBSECRETARIA DE TRANSPORTES,AN001,Con personalidad jurídica,
903,,,Gobierno de Singapur,,,,Gobierno de Singapur,,,SUBSECRETARIA DE TRANSPORTES,AN001,Sin personalidad jurídica ,
995,650796160,,Actus A.G.,La Concepcion N° 191, Of. 802, Providencia,Asociacion de Transporte,Hector Moya,Asociacion de Transporte,Asociacion de Trasnporte,,SUBSECRETARIA DE TRANSPORTES,AN001,Con personalidad jurídica,
996,650857291,,Asociación de Motoristas Pro Chile,Ortiz de rosas 586, Recoleta,Personalidad Jurídica sin fines de lucro,Clara Espinoza,Formación, capacitación y actividades recreativas en motocicletas, clases de conducción, seguridad vial y primeros auxilios,Limitada,,SUBSECRETARIA DE TRANSPORTES,AN001,Con personalidad jurídica,
959,995333902,,Applus Chile S.A.,Av. Américo Vespucio Nº 743, comuna de Huechuraba,Servicio de Revisión Técnica de Vehículos,Luis Arellano,Servicio de Revisión Técnica de Vehículos,Sociedad Anónima,,SUBSECRETARIA DE TRANSPORTES,AN001,Con personalidad jurídica,
787,700598004,,Radio Club de Chile,Nataniel Cox 1054,RadioComunicaciones,Galdino Besomi Sani,Servicio de Aficionados a las Comunicaciones,Corp. Privada sin fines de lucro,,SUBSECRETARÍA DE TELECOMUNICACIONES,AN002,Con personalidad jurídica,
788,78439246,,Radio Club de Chile,Nataniel 1054,Institución sin fines de lucro,Galdino Benoni,Servicio de Radiocomunicaciones,Corporación sin fines de lucro,,SUBSECRETARÍA DE TELECOMUNICACIONES,AN002,Con personalidad jurídica,
789,76709180k,,Consultora Apolonia Ratinoff E.I.R.L.,Lo Fontecilla 101, Oficina 402, Las Condes,Consultora,Apolonia Ratinoff Ratinoff,Asesoramiento gestion empresarial,Empresa Individual de Responsabilidad Limitada,,SUBSECRETARÍA DE TELECOMUNICACIONES,AN002,Con personalidad jurídica,
790,78144890,,Consultora Apolonia Ratinoff E.I.R.L.,Lo Fontecilla 101 Oficina 402, Las Condes,Consultora,Apolonia Ratinoff Ratinoff,Asesoramiento en materia de gestion,Empresa de Responsabilidad Limitada,,SUBSECRETARÍA DE TELECOMUNICACIONES,AN002,Con personalidad jurídica,
793,857838009,,Complejo Manufacturero de Equipos Telefónicos S.A.C.I,Av. Walker Martinez  N° 911,Telecomunicaciones,Maureen Barra Yates,ISP, Servicios Limitados de TV.Cable, Telefonia Fija,Sociedad Anonima,,SUBSECRETARÍA DE TELECOMUNICACIONES,AN002,Con personalidad jurídica,
796,878455002,,telefónica móviles chile s.a.,avenida providencia N° 111, Providencia,telecomunicaciones,Roberto Muñoz,concesionaria de servicios de telecomunicaciones,sociedad anónima,,SUBSECRETARÍA DE TELECOMUNICACIONES,AN002,Con personalidad jurídica,
797,655260404,,Sindicato Nacional de Ingenieros Entel PCS S.A.,Av. Andrés Bello 2711, piso 13, Las Condes,Sindicato,Carmen Miranda A.,Sindicato,Sindicato,,SUBSECRETARÍA DE TELECOMUNICACIONES,AN002,Con personalidad jurídica,
798,78452650k,,VTR GlobalCom S.A.,Avenida del Valle Sur 534, Huechuraba,Servicio de telecomunicaciones,Guillermo Ponce Miguel,Servicio de telecomunicaciones,Sociedad por Acciones,,SUBSECRETARÍA DE TELECOMUNICACIONES,AN002,Con personalidad jurídica,
800,789216908,,NEXTEL S.A.,Presidente Riesco 5435, Piso 16, Las Condes,Empresa de Telecomunicaciones,Estanislao Peña,Empresa de Telecomunicaciones,Sociedad Anónima,,SUBSECRETARÍA DE TELECOMUNICACIONES,AN002,Con personalidad jurídica,
1289,767387202,,Bernstein y Woodward Comunicaciones Limitada,Augusto Leguía Norte 100, oficina 201, Las Condes, Santiago,Comunicaciones,Juan de Dios Larraín Matte,Servicios Comunicacionales, Promoción, Publicidad y Marketing,Sociedad Limitada,,SUBSECRETARÍA DE TELECOMUNICACIONES,AN002,Con personalidad jurídica,True
1313,925800007,,Entel S.A.,Costanera Sur 2760 piso 22, Las Condes Santiago,Telecomunicaciones,Antonio Büchi Buc,Telecomunicaciones,Sociedad Anónima,,SUBSECRETARÍA DE TELECOMUNICACIONES,AN002,Con personalidad jurídica,False
