IDEntidad,Rut,CodigoInt,nombre,domicilio,giro,representante,actividades,naturaleza,administrador,institucion,idportal,tipoEntidad,remunerado
627,968099701,,Unidad De Leasing Habitacional S.A.,Av. Apoquindo N° 3.200 Piso 6,Leasing Habitacional,,,,,SENADO,NR005,Con personalidad jurídica,
628,65019571k,,Iglesia,Monsalve 275,Organización religiosa,,,Organización religiosa,,SENADO,NR005,Con personalidad jurídica,
631,700083101,,Cámara Nacional De Comercio, Servicios Y Turismo De Chile,Merced 230,Federación Gremial,,,Presidente,,SENADO,NR005,Con personalidad jurídica,
632,965057609,,Colbún S.A.,Apoquindo 4775, Piso 11,Generación Energía Eléctrica,,,Gestión de intereses particulares,,SENADO,NR005,Con personalidad jurídica,
633,126198841,,Federacion Nacional Funcionarios Ministerio Publico,GRAN AVENIDA 3814,SINDICATO NACIONAL,,,SINDICATO NACIONAL,,SENADO,NR005,Con personalidad jurídica,
634,760781207,,C Y H Consulting Y Cía Ltda.,parcelación San Pedro, parcela 25,biotecnologia,,,representante,,SENADO,NR005,Con personalidad jurídica,
635,61704000k,,Corporación Nacional Del Cobre,Huérfanos 1270,Empresa Minera Comercial,,,gestión de intereses particulares,,SENADO,NR005,Con personalidad jurídica,
637,,,Instituto Nacional De Chile,,,,Educacional,,,SENADO,NR005,Sin personalidad jurídica ,
638,658090305,,Asociación Nacional De Funcionarios Del Ministerio Público,Av. Irarrázaval 4957,Asociación Gremial,,,Representación nacional de los funcionarios del Ministerio Público en todas las materias de su interés.,,SENADO,NR005,Con personalidad jurídica,
639,763219232,,Track Group Chile Spa,MIRAFLORES 222 PISO 28,VENTA AL POR MAYOR DE OTROS PRODUCTOS,,,PROTOCOLAR,,SENADO,NR005,Con personalidad jurídica,
641,650810678,,Organización Funcional Sin Fines De Lucro,Lautaro 712,organización Comunitaria,,,,,SENADO,NR005,Con personalidad jurídica,
642,828834002,,Colegio De Tecnologos Medicos De Chile A.G.,JOSE MIGUEL DE LA BARRA N° 480 DEPTO. 405,ASOCIACION GREMIAL,,,PRESIDENTA DEL COLEGIO DE TECNOLOGOS MEDICOS DE CHILE A.G.,,SENADO,NR005,Con personalidad jurídica,
643,910810006,,Empresa Nacional De Electricidad S.A.,Santa Rosa N° 76,Generación de energía eléctrica,,,Contractual,,SENADO,NR005,Con personalidad jurídica,
644,788970609,,Correa Y Correa Consultores Ltda,Avenida Providencia 1760,Consultorías,,,Asesoría empresa ISA (Colombia),,SENADO,NR005,Con personalidad jurídica,
646,995943506,,Andes Wind Parks S.A.,Los Militares 4290, Piso 8,ENERGÍA,,,gestión de intereses particulares,,SENADO,NR005,Con personalidad jurídica,
413,650744640,,Multigremial de La Araucanía,Prat 748 Oficina 503 Temuco,gremios empresariales,Emilio Taladriz Montencinos,Gremios empresariales,Persona Jurídica,,MINISTERIO PUBLICO,NR008,Con personalidad jurídica,
414,761086359,,PROSE CHILE ,LA CONCEPCIÓN 322 OFICINA 505,SOCIEDAD DE APOYO AL GIRO ,HERNAN CARVALLO JARPA,SOCIEDAD DE APOYO AL GIRO,SOCIEDAD POR ACCIONES,,MINISTERIO PUBLICO,NR008,Con personalidad jurídica,
415,858052009,,Bosques Arauco S.A.,Los Horcones s/n, Arauco.,Forestal.,Rigoberto Rojo, gerente zonal.,Forestal,Sociedad anónima.,,MINISTERIO PUBLICO,NR008,Con personalidad jurídica,
422,699036005,,Embajada del Japón,Ricardo Lyon 520, Providencia, Santiago,Representación diplomática,Naoto Nikai,Representación diplomática,Representación diplomática,,MINISTERIO PUBLICO,NR008,Con personalidad jurídica,
423,96623220K,,Volterra S.A.,Cochrane 361, Concepción,Producción y comercialización de astilla de madera,Tadayoshi Kobayashi,Producción y comercialización de astilla de madera,Comercial,,MINISTERIO PUBLICO,NR008,Con personalidad jurídica,
427,651387604,,Carmelitas Descalzas del Amor Misericordioso y de la Virgen del Carmen,Parcela 18, Manzana D, Loteo J, sector El Peumo, Cajón del Maipo,Religiosas,María Elisa Castillo Niño,Religiosas,Religiosa,,MINISTERIO PUBLICO,NR008,Con personalidad jurídica,
1201,650903412,,Fundación Multitudes,Miraflores 113 Oficina 64,Fundación,Paulina Ibarra,Servicios de institutos de estudios, fundaciones, corporación de desarrollo,Fundación,,CONSEJO PARA LA TRANSPARENCIA,CT001,Con personalidad jurídica,False
40,,07689002000189,EMBRAER DEFENSA & SEGURIDAD,SAO JOSE DOS CAMPOS SP BRASIL,AVIONES Y  SISTEMAS DE DEFENSA,JACKSON SCHNEIDER,INDUSTRIA AEROESPACIAL,INDUSTRIA Y COMERCIO,,INSTITUCION DE PRUEBA,XX000,Con personalidad jurídica,
109,,452769390,Greewood Energy,134 East 40th St New York, NY 10016, Estados Unidos,Generación de Energía Electrica,Camilo Patrignani,Desarrollo, Construccion y Explotacion de Proyectos de Energia Renovable,Sociedad de Responsabilidad Limitada,,INSTITUCION DE PRUEBA,XX000,Con personalidad jurídica,
110,,452769390,Greenwood Energy,134 East 40th St New York, NY 10016, Estados Unidos,Generación de Energía Eléctrica,Camilo Patrignani,Desarrollo, Construcción y Explotación de Proyectos de Energía Renovable,Sociedad de Responsabilidad Limitada,,INSTITUCION DE PRUEBA,XX000,Con personalidad jurídica,
149,,nn,Corporación Andina de Fomento,Torre CAF CARACAS,   Avda. Luis Roche,Finanzas y Cooperación,Enrique García,Banco de Desarrollo,Corporación,,INSTITUCION DE PRUEBA,XX000,Con personalidad jurídica,
168,,07689002000189,Embraer Defensa & Seguridad,Sao Jose dos Campo, Sao Paulo, Brasil,Ind e Com Aviones y Sistemas de Defensa,Jackson Schneider,Industria Aeroespacial,Sociedad Anonima,,INSTITUCION DE PRUEBA,XX000,Con personalidad jurídica,
169,,07689002000189,EMBRAER DEFENSA & SEGURIDAD,SAO JOSE DOS CAMPOS, SAO PAULO,  BRASIL,IND E COM AVIONES Y SISTEMAS DE DEFENSA,JACKSON SCHNEIDER,INDUSTRIA AEROESPACIAL,SOCIEDAD ANONIMA,,INSTITUCION DE PRUEBA,XX000,Con personalidad jurídica,
170,,07689002000189,EMBRAER DEFENSA  & SEGURIDAD,SAO JOSE DOS CAMPOS SAO PAULO BRASIL,IND E COM AVIONES & SISTEMAS DE DEFENSA,JACKSON SCHNEIDER,IND AEROESPACIAL,SOCIEDAD ANONIMA,,INSTITUCION DE PRUEBA,XX000,Con personalidad jurídica,
171,,07689002000189,EMBRAER DEFENSA & SEGURIDAD,SAO JOSE DOS CAMPOS SAO PAULO BRASIL,IND E COM AVIONES Y SISTEMAS DE DEFENSA,JACKSON SCHNEIDER,IND AEROESPACIAL,SOCIEDAD ANONIMA,,INSTITUCION DE PRUEBA,XX000,Con personalidad jurídica,
205,,Pasaporte,TomTom Brasil Comércio e Marketing de Soluções de Navegação Ltda.,São Paulo, Brasil,NA,Marcelo Dias Fernandes,Sistemas de navegación y monitoreo de trafego,Sociedad limitad.,,INSTITUCION DE PRUEBA,XX000,Con personalidad jurídica,
208,,2021002098,Exportkreditnämnden,Kungsgatan 36, 103 61 Estocolmo, Suecia,Financiero,Karin Apelman (Directora General),Asegurar empresas exportadoras y bancos contra el riesgo de impago en operaciones de exportación,Entidad pública sueca,,INSTITUCION DE PRUEBA,XX000,Con personalidad jurídica,
216,766870006,,Asociación Empresas Consultoras de Ingeniería de Chile (AIC),Miguel Claro 119, piso 2,Asociación de empresas,Francisco Aracena Deza,Asociación Gremial,Institución sin fines de lucro,,INSTITUCION DE PRUEBA,XX000,Con personalidad jurídica,
218,864986007,,Novojet Chile S.A.,La Concepcion 266. of 501,turismo,Johnny Cerda Peña,Tour operador mayorista,Sociedad Anonima,,INSTITUCION DE PRUEBA,XX000,Con personalidad jurídica,
219,854986007,,Novojet Chile S.A.,La Concepcion 266 of 502,Turismo,Johnny cerda Peña,Tour Operador Mayorista,Sociedad Anonima,,INSTITUCION DE PRUEBA,XX000,Con personalidad jurídica,
221,650796845,,Grupo Habitacional Bicentenario,Av. Buenos Aires 1, San Clemente,Social,Nataly Cornejo Briones,Promover soluciones habitacionales a sus socios,Organización social,,INSTITUCION DE PRUEBA,XX000,Con personalidad jurídica,
222,650908031,,Comité Habitacional Don Fermin I,Alejandro Cruz 151, San Clemente,Organización Social,Sandra Muñoz Rioseco,Promover soluciones habitacionales a sus socios,Organización Social,,INSTITUCION DE PRUEBA,XX000,Con personalidad jurídica,
223,724562000,,ANAC,Avda. Presidente Kennedy 9070, oficina 702,Asociación Gremial,Alvaro Mendoza,Asociación Gremial,Presidente,,INSTITUCION DE PRUEBA,XX000,Con personalidad jurídica,
225,97036000k,,Banco Santander Chile,bandera 140 santiago,banco comercial,claudio melandri,banco comercial,sociedad anonima,,INSTITUCION DE PRUEBA,XX000,Con personalidad jurídica,
230,650195086,,Federación de Empresas de Turismo de Chile (Fedetur),Coímbra 110, of. 302, Las Condes,---,Eugenio Yunis,Federación gremial,Gremio,,INSTITUCION DE PRUEBA,XX000,Con personalidad jurídica,
231,,07689002000189,EMBRAER DEFENSA & SEGURIDAD,SAO JOSE DOS CAMPOS SP BRASIL,AVIONES Y  SISTEMAS DE DEFENSA,JACKSON SCHNEIDER,INDUSTRIA AEROESPACIAL,INDUSTRIA Y COMERCIO,,INSTITUCION DE PRUEBA,XX000,Con personalidad jurídica,
232,761989081,,Newsholding S.P.A.,Paseo Bulnes 120, of. 69, Santiago,Publicidad y medios de comunicación,Leonardo Meyer Zúñiga,Medio de comunicación,Holding,,INSTITUCION DE PRUEBA,XX000,Con personalidad jurídica,
242,760310719,,Salcobrand SA,Av. General Velasquez 9981, San Bernardo,Farmacias,Alberto Novoa Pacheco,Farmacias,Sociedad Anónima,,INSTITUCION DE PRUEBA,XX000,Con personalidad jurídica,
243,71695000k,,FEDERACION NACIONAL DE SINDICATOS DE TRABAJADORES DE LAS EMPRESAS FARMACEUTICAS DE CHILE,Monjitas 843 Oficina 7001 Edificio C,Organización sindical,Mauricio Acevedo,Organización sindical,Sociedad Anónima,,INSTITUCION DE PRUEBA,XX000,Con personalidad jurídica,
249,760837881,,ROLLER GROUP LIMITADA,NAPOLEON 3565 OF.202, LAS CONDES,COMERCIALIZADORA INDUSTRIAL,RODRIGO GUERRA ESCALONA,REPRESENTACIONES INDUSTRIALES EUROPEAS,LIMITADA,,INSTITUCION DE PRUEBA,XX000,Con personalidad jurídica,
250,126889178,,ROLLER GROUP LIMITADA,NAPOLEON 2565 OF. 202, LAS CONDES,COMERCIALIZADORA INDUSTRIAL,RODRIGO GUERRA,REPRESENTACIONES INDUSTRIALES EUROPEAS,LIMITADA,,INSTITUCION DE PRUEBA,XX000,Con personalidad jurídica,
251,700232107,,ACHET,Av. Providencia 2019, Oficna 42-B,Asociacion Gremial,Guillermo Correa,Representacion de inquetudes de socios,Gremios,,INSTITUCION DE PRUEBA,XX000,Con personalidad jurídica,
254,818674007,,Federación de Tripulantes de la Marina Mercante de Chile,José Tomás Ramos N° 68   Valparaíso,Sindicato,Hernán Winter Levicoy,Federación,Organización Sindical,,INSTITUCION DE PRUEBA,XX000,Con personalidad jurídica,
255,609100001,,UNIVERSIDAD DE CHILE,ALAMEDA BERNARDO O´HIGGINS S/N,UNIVERSIDAD,ENNIO VIVALDI,EDUCACIONALES,CORPORACION,,INSTITUCION DE PRUEBA,XX000,Con personalidad jurídica,
256,690728001,,MUNICIPALIDAD DE LA REINA,AV. ALCALDE F. CASTILLO V. 9925,MUNICIPALIDAD,RAUL DONCKASTER,MUNICIPALIDAD,CORPORACION,,INSTITUCION DE PRUEBA,XX000,Con personalidad jurídica,
259,618120007,,SERVIU  Metropolitano,Arturo Prat N° 48,no tiene,Alberto Pizarro Saldías,Servicio Público,Servicio Público,,INSTITUCION DE PRUEBA,XX000,Con personalidad jurídica,
263,658445707,,Federación de Sindicatos de Metro S.A,Av. Lib. Bdo. OHiggins 1632 of. 401-402 piso 4,Otras Actividades Sindicales,Eujenio de la Cruz Valenzuela Arriagada,Organización sindical,Organización sindical,,INSTITUCION DE PRUEBA,XX000,Con personalidad jurídica,
266,769818200,,Azerta Comunicaciones,Américo Vespucio 1561, piso 6,Asesorías comunicacionales y Asuntos Públicos,Felipe Edwards Marín,Minería, energía, retail, agrícola, financiera, puertos, obras públicas, mercados regulados, entre otras materias.,Sociedad Anónima Cerrada,,INSTITUCION DE PRUEBA,XX000,Con personalidad jurídica,
267,63850609,,TATA CONSULTANCY SERVICES CHILE S.A.,Curicó N° 18 - Santiago,Asesores y consultores en informática,Alejandro Valenzuela Lagos,Empresa de servicios integrales de informática,Sociedad Anónima Cerrada,,INSTITUCION DE PRUEBA,XX000,Con personalidad jurídica,
268,763850609,,TATA CONSULTANCY SERVICES CHILE S.A.,Curicó N° 18 - Santiago,Asesores y consultores en informática,Alejandro Valenzuela Lagos,Empresa de servicios integrales de informática,Sociedad Anónima Cerrada,,INSTITUCION DE PRUEBA,XX000,Con personalidad jurídica,
278,81458500k,,Camara Chilena de la Construcción,Marchant Pereira,Construcción,Jorge Mas Figueroa,Gremio,Asociación Gremial,,INSTITUCION DE PRUEBA,XX000,Con personalidad jurídica,
279,53472400,,Jorge Mas,Marchant Pereira 10. piso 3,Asociación Gremial,Sergio Cavagnaro Santa Marïa,Asociación Gremial,Asociación Gremial,,INSTITUCION DE PRUEBA,XX000,Con personalidad jurídica,
283,700026604,,CONFEDERACIÓN DE LA pPRODUCCIÓN Y DEL COMERCIO,MONSEÑOR SÓTERO SANZ 182, PROVIDENCIA,GREMIO EMPRESARIAL,ANDRÉS SANTA CRUZ LÓPEZ,•  Defender y promover el derecho de propiedad privada; •  Defender y promover la libertad de empresa, entendida como el conjunto de condiciones que faciliten la creación y mantención de iniciativas empresariales y un marco económico, legal, tributario y ,CONFEDERACIÓN DE FEDERACIONES Y ASOCIACIONES GREMIALES,,INSTITUCION DE PRUEBA,XX000,Con personalidad jurídica,
286,743255003,,Consejo Minero,Av. Apoquindo 35002, Piso 7,Gremio Empresarial,Joaquín Villarino Herrera,Gremiales,Asociación Gremial,,INSTITUCION DE PRUEBA,XX000,Con personalidad jurídica,
292,743481003,,Asociación de Pensionados Montepiados por accidentes en actos de servicio de la empresa de Ferrocarriles del Estado,.,.,.,.,.,,INSTITUCION DE PRUEBA,XX000,Con personalidad jurídica,
293,968679902,,IberoAmericana Radio Chile,Avenida Eliodoro Yañez 1783, Providencia,Radiodifusión,Ricardo Berdicheski Sommerfeld,Actividades de información, música, entretenimiento y deportes,Sociedad Anónima,,INSTITUCION DE PRUEBA,XX000,Con personalidad jurídica,
294,966337605,,Microsoft,Vitacura 6844,Software,Oliver Flogel,Marketing,Sociedad Anónima,,INSTITUCION DE PRUEBA,XX000,Con personalidad jurídica,
296,970320008,,Banco  Bilbao Vizcaya Argentaria Chile,Pedro de Valdivia 100 , Santiago,Banco,Manuel Olivares Rossetti / Gerente General,Financieras,Sociedad Anónima,,INSTITUCION DE PRUEBA,XX000,Con personalidad jurídica,
299,761789686,,Pacific Solar S.A.,Presidente Batlle y Ordoñez 3784,Ñuñoa, Santiago de Chile,Servicios de Ingeniería y Generación de Energía Eléctrica,Guillermo Miranda Orchad,Desarrollo de Proyectos de Energía Solar,Sociedad Anónima,,INSTITUCION DE PRUEBA,XX000,Con personalidad jurídica,
300,,452769390,Greewood Energy,134 East 40th St New York, NY 10016, Estados Unidos,Generación de Energía Electrica,Camilo Patrignani,Desarrollo, Construccion y Explotacion de Proyectos de Energia Renovable,Sociedad de Responsabilidad Limitada,,INSTITUCION DE PRUEBA,XX000,Con personalidad jurídica,
301,,452769390,Greenwood Energy,134 East 40th St New York, NY 10016, Estados Unidos,Generación de Energía Eléctrica,Camilo Patrignani,Desarrollo, Construcción y Explotación de Proyectos de Energía Renovable,Sociedad de Responsabilidad Limitada,,INSTITUCION DE PRUEBA,XX000,Con personalidad jurídica,
307,797240605,,Antuan Jury SA,Limache 3116 El Salto, Viña del Mar,Fabrica e Importadora de Ropa de Trabajo Vestuario Corporativo y Publicitario,Antuan Jury Sara,Vestuario Corporativo e Industrial,Sociedad Anónima,,INSTITUCION DE PRUEBA,XX000,Con personalidad jurídica,
308,125965016,,Sindicato de Armadores de Caldera, III Región,Muelle Fiscal s/n, Caldera,Organización Sindical,Giuliano Reynuaba Salas,Pesca Artesanal,Sociedad Anónima,,INSTITUCION DE PRUEBA,XX000,Con personalidad jurídica,
309,71269736,,Sindicato de Armadores de Caldera, III Región,Muelle Fiscal s/n, Caldera,Organización Sindical,Giulliano Reynuaba,Pesca Artesanal,Sociedad Anónima,,INSTITUCION DE PRUEBA,XX000,Con personalidad jurídica,
310,5761501k,,CERCOPESCA, IV Región,Avenida Osandón N° 828, Coquimbo,cooperativa,Angel Cortés,Armadores cerqueros,cooperativa,,INSTITUCION DE PRUEBA,XX000,Con personalidad jurídica,
311,145897483,,CERCOPESCA, IV Región,Avenida Osandón 828, Coquimbo,cooperativa,Angel Cortes,Armadores cerqueros,cooperativa,,INSTITUCION DE PRUEBA,XX000,Con personalidad jurídica,
312,112913858,,SIPES MAFESA Coronel,Mackay 175, Lo Rojas, Coronel,Organización Gremial,Marcelo Segura,Pesca Artesanal,sociedad anonima,,INSTITUCION DE PRUEBA,XX000,Con personalidad jurídica,
314,703462006,,Asociacion canalistas canal zañartu,zañartu 155 a cabrero,riego agricola,patricio sabag,riego agricola,asociacion gremial,,INSTITUCION DE PRUEBA,XX000,Con personalidad jurídica,
317,823148003,,ASOCIACION DE NOTARIOS CONSERVADORES ARCHIVEROS JUDICIALES,BULNES 79 PISO QUINTO,GREMIALES,ARMANDO ARANCIBIA,GREMIALES,ASOCIACION GREMIAL,,INSTITUCION DE PRUEBA,XX000,Con personalidad jurídica,
318,762754533,,TECHPACK S.A.,Presidente Eduardo Frei Montalva N° 9160, Quilicura,Inversiones,Claudio Inglesi,Inversiones,No indica,,INSTITUCION DE PRUEBA,XX000,Con personalidad jurídica,
319,91787148,,ANFUP Asociación Gremial,Santa Mónica N° 2318,Dirigente Gremial y presidente,Pedro Hernández P.,Dirigente Gremial,Agrupación Gremial,,INSTITUCION DE PRUEBA,XX000,Con personalidad jurídica,
321,947270001,,Gtd Grupo Teleductos S.A.,Moneda 920, piso 11, Santiago,Telecomunicaciones,Alberto José Bezanilla Donoso,Telecomunicaciones,Sociedad Anónima,,INSTITUCION DE PRUEBA,XX000,Con personalidad jurídica,
322,902990003,,Telefónica del Sur S.A.,San Carlos 107, ciudad y comuna de Valdivia,Telecomunicaciones,Juan Carlos Velenzuela Herrera,Telecomunicaciones,Sociedad Anónima,,INSTITUCION DE PRUEBA,XX000,Con personalidad jurídica,
326,700134407,,ASOCIACION HOGAR DE NIÑOS ARTURO PRAT,BLANCO N° 1623 VALPARAISO,EDUCACION BASICA GRATUITA,CARLOS SCHNAIDT PARKER,CORPORACION,CORPORACION SIN FINES DE LUCRO,,INSTITUCION DE PRUEBA,XX000,Con personalidad jurídica,
329,966824301,,Motorola Solutions Chile S.A.,Av. Nueva Tajamar 481, Torre Norte, Oficina 1702, Edificio World Trade Center, Las Condes,Telecomunicaciones,Gabriel Contesse Orellana,Telecomunicaciones,S.A.,,INSTITUCION DE PRUEBA,XX000,Con personalidad jurídica,
330,774067205,,Regulación & Mercados - GC,Suecia 15, Of 74, Providencia, Santiago,Consultoría,Cristian Rojas Pérez,Consultoría,Ltda,,INSTITUCION DE PRUEBA,XX000,Con personalidad jurídica,
332,814589005,,Asociación de Bancos e Instituciones Financieras de Chile A.G.,Nueva Costanera 4091, Piso 4 Vitacura,Asociación Gremial,Jorge Awad Mehech,Asociación Gremial,Asociación Gremial,,INSTITUCION DE PRUEBA,XX000,Con personalidad jurídica,
333,968567802,,ISAPRE CONSALUD S.A.,PEDRO FONTOVA N°6650 HUECHURABA SANTIAGO,ISAPRE,MARCELO SUTIL LABBÉ,ISAPRE,SOCIEDAD ANÓNIMA CERRADA,,INSTITUCION DE PRUEBA,XX000,Con personalidad jurídica,
337,798009001,,TRANSPORTES DELFOS LIMITADA,PADRE MARIANO 87 OFICINA 101,TRANSPORTE DE PASAJEROS,PATRICIO DE LA FUENTE,TRANSPORTES,LIMITADA,,INSTITUCION DE PRUEBA,XX000,Con personalidad jurídica,
338,721091007,,APR Batuco - Santa Sara,España Sitio 1, Manzana 6, Batuco,Agua Potable,Luis Parada Acevedo,Distribución y Captación Agua Potable,sin información,,INSTITUCION DE PRUEBA,XX000,Con personalidad jurídica,
339,65049329k,,Comité Vivienda "Hogar Feliz",sin informaión,sin informaión,Sara Morales,sin informaión,sin informaión,,INSTITUCION DE PRUEBA,XX000,Con personalidad jurídica,
340,,nn,Corporación Andina de Fomento,Torre CAF CARACAS,   Avda. Luis Roche,Finanzas y Cooperación,Enrique García,Banco de Desarrollo,Corporación,,INSTITUCION DE PRUEBA,XX000,Con personalidad jurídica,
341,700598004,,Radio Club de Chile,Nataniel Cox 1054,RadioComunicaciones,Galdino Besomi Sani,Servicio de Aficionados a las Comunicaciones,Corp. Privada sin fines de lucro,,INSTITUCION DE PRUEBA,XX000,Con personalidad jurídica,
342,78439246,,Radio Club de Chile,Nataniel 1054,Institución sin fines de lucro,Galdino Benoni,Servicio de Radiocomunicaciones,Corporación sin fines de lucro,,INSTITUCION DE PRUEBA,XX000,Con personalidad jurídica,
343,76709180k,,Consultora Apolonia Ratinoff E.I.R.L.,Lo Fontecilla 101, Oficina 402, Las Condes,Consultora,Apolonia Ratinoff Ratinoff,Asesoramiento gestion empresarial,Empresa Individual de Responsabilidad Limitada,,INSTITUCION DE PRUEBA,XX000,Con personalidad jurídica,
344,78144890,,Consultora Apolonia Ratinoff E.I.R.L.,Lo Fontecilla 101 Oficina 402, Las Condes,Consultora,Apolonia Ratinoff Ratinoff,Asesoramiento en materia de gestion,Empresa de Responsabilidad Limitada,,INSTITUCION DE PRUEBA,XX000,Con personalidad jurídica,
347,857838009,,Complejo Manufacturero de Equipos Telefónicos S.A.C.I,Av. Walker Martinez  N° 911,Telecomunicaciones,Maureen Barra Yates,ISP, Servicios Limitados de TV.Cable, Telefonia Fija,Sociedad Anonima,,INSTITUCION DE PRUEBA,XX000,Con personalidad jurídica,
350,878455002,,telefónica móviles chile s.a.,avenida providencia N° 111, Providencia,telecomunicaciones,Roberto Muñoz,concesionaria de servicios de telecomunicaciones,sociedad anónima,,INSTITUCION DE PRUEBA,XX000,Con personalidad jurídica,
351,655260404,,Sindicato Nacional de Ingenieros Entel PCS S.A.,Av. Andrés Bello 2711, piso 13, Las Condes,Sindicato,Carmen Miranda A.,Sindicato,Sindicato,,INSTITUCION DE PRUEBA,XX000,Con personalidad jurídica,
352,78452650k,,VTR GlobalCom S.A.,Avenida del Valle Sur 534, Huechuraba,Servicio de telecomunicaciones,Guillermo Ponce Miguel,Servicio de telecomunicaciones,Sociedad por Acciones,,INSTITUCION DE PRUEBA,XX000,Con personalidad jurídica,
354,789216908,,NEXTEL S.A.,Presidente Riesco 5435, Piso 16, Las Condes,Empresa de Telecomunicaciones,Estanislao Peña,Empresa de Telecomunicaciones,Sociedad Anónima,,INSTITUCION DE PRUEBA,XX000,Con personalidad jurídica,
358,909430003,,ALCATEL-LUCENT DE CHILE S.A.,Avenida Providencia 1760 p. 20,Telecomunicaciones,Luis Pedro Sanguinetti,Comercialización de Equipos y servicios de telecomunicaciones,Representante Legal,,INSTITUCION DE PRUEBA,XX000,Con personalidad jurídica,
359,,07689002000189,Embraer Defensa & Seguridad,Sao Jose dos Campo, Sao Paulo, Brasil,Ind e Com Aviones y Sistemas de Defensa,Jackson Schneider,Industria Aeroespacial,Sociedad Anonima,,INSTITUCION DE PRUEBA,XX000,Con personalidad jurídica,
360,,07689002000189,EMBRAER DEFENSA & SEGURIDAD,SAO JOSE DOS CAMPOS, SAO PAULO,  BRASIL,IND E COM AVIONES Y SISTEMAS DE DEFENSA,JACKSON SCHNEIDER,INDUSTRIA AEROESPACIAL,SOCIEDAD ANONIMA,,INSTITUCION DE PRUEBA,XX000,Con personalidad jurídica,
361,,07689002000189,EMBRAER DEFENSA  & SEGURIDAD,SAO JOSE DOS CAMPOS SAO PAULO BRASIL,IND E COM AVIONES & SISTEMAS DE DEFENSA,JACKSON SCHNEIDER,IND AEROESPACIAL,SOCIEDAD ANONIMA,,INSTITUCION DE PRUEBA,XX000,Con personalidad jurídica,
362,,07689002000189,EMBRAER DEFENSA & SEGURIDAD,SAO JOSE DOS CAMPOS SAO PAULO BRASIL,IND E COM AVIONES Y SISTEMAS DE DEFENSA,JACKSON SCHNEIDER,IND AEROESPACIAL,SOCIEDAD ANONIMA,,INSTITUCION DE PRUEBA,XX000,Con personalidad jurídica,
366,111111111,,Agrupación Ex Conscriptos Bio Bio,O´Higgins 412 Nacimiento,Agrupación,Juan Díaz Saez,organización social,Organización social,,INSTITUCION DE PRUEBA,XX000,Con personalidad jurídica,
367,733916001,,Fundación Teram,Av. Bustamente 24, Dpto I Providencia,Estudios,Fundación Terram,Fundación TERRAM o Fundación  para la Promoción del Desarrollo Sustentable,Estudios,,INSTITUCION DE PRUEBA,XX000,Con personalidad jurídica,
370,760283452,,Kinross Minera Chile Ltda.,Cerro Colorado 52 40 Torre II Piso 18,Mineria,Ximena Matas,Operaciones mineras,Sociedad Limitada,,INSTITUCION DE PRUEBA,XX000,Con personalidad jurídica,
373,768601402,,Herencia Resources S.A.,Burgos 80 Piso 12,Exploracion Minera,John Porter,Mineria,Sociedad Anonima,,INSTITUCION DE PRUEBA,XX000,Con personalidad jurídica,
374,765812208,,Pedro Cardenas,Cerro Colorado 5240 Torres del Parque II Piso 9 Oficina A,Apoyo Servicios Gerenciales,Andres Guzman-Roberto Alarcon-Gerardo Fernandez,Apoyo Servicios Generales Yamana Chile Ltda.,Sociedad responsabilidad  LTda,,INSTITUCION DE PRUEBA,XX000,Con personalidad jurídica,
376,761592858,,Ceilom - Centro de Investigación y Desarrollo de Lombricultura,Avenida Nueva Providencia 1881 - of 1620,Asesoría y Capacitación,Marcela Campos Parada,Desarrollo de Proyectos de Recuperación Energética a través de la transformación y valoración de la Materia Orgánica.,Sociedad Limitada,,INSTITUCION DE PRUEBA,XX000,Con personalidad jurídica,
383,814460002,,Sociedad Nacional de Minería F.G.,Avenida Apoquindo 3.000, 5° piso, Las Condes, Santiago,Gremio Minero,Alberto Salas Muñoz,Representar a sus afiliados y promover, coordinar y dirigir las acciones que éstos lleven a cabo en relación con la racionalización, desarrollo y  protección de la actividad minera y de las conexas a dicha actividad,Federación Gremial,,INSTITUCION DE PRUEBA,XX000,Con personalidad jurídica,
384,796101008,,Ingeniería de Combustión Bosca Chile S.A.,Av. A Vespuciuo Norte 2077, Huechuraba,fábrica de productos metálicos y exportación,Juan Carlos Larrain W.,fabricación, comercialización de calefactores a leña, pellets, eléctricos entre otros productos,sociedad anónima cerrada,,INSTITUCION DE PRUEBA,XX000,Con personalidad jurídica,
385,,,Carlos Perez Cortes,,,,Medico,,,INSTITUCION DE PRUEBA,XX000,Sin personalidad jurídica ,
386,826217006,,colegio medico de chile a.g.,esmeralda 678,asociaciòn gremial,Enrique Parìs Mancilla,representacion gremio mèdico,asociacion gremial,,INSTITUCION DE PRUEBA,XX000,Con personalidad jurídica,
388,658876104,,Comité de Vivienda Villa El Estero,Nueva Dos 670, Cholchol,Comité de Vivienda,Liliana Breve Viveros,Promover soluciones habitacionales a sus socios,Organización Social,,INSTITUCION DE PRUEBA,XX000,Con personalidad jurídica,
390,650597141,,Comité de Vivienda Los Kiwis,Pérez 449, Cholchol,Comité de Vivienda,Luis Levio Lienqueo,Promover soluciones habitacionales a sus socios,Organización Social,,INSTITUCION DE PRUEBA,XX000,Con personalidad jurídica,
392,650628497,,Comité de vivienda Las Violetas,Lazcano 580, Cholchol,Comité de vivienda,Consuelo Astudillo Llevul,Promover soluciones habitacionales a sus socios,Organización social,,INSTITUCION DE PRUEBA,XX000,Con personalidad jurídica,
